
*** Running vivado
    with args -log digital_clock.vds -m64 -product Vivado -mode batch -messageDb vivado.pb -notrace -source digital_clock.tcl


ECHO is off.
ECHO is off.

****** Vivado v2023.2 (64-bit)
  **** SW Build 4029153 on Fri Oct 13 20:14:34 MDT 2023
  **** IP Build 4028589 on Sat Oct 14 00:45:43 MDT 2023
  **** SharedData Build 4025554 on Tue Oct 10 17:18:54 MDT 2023
    ** Copyright 1986-2022 Xilinx, Inc. All Rights Reserved.
    ** Copyright 2022-2023 Advanced Micro Devices, Inc. All Rights Reserved.

source digital_clock.tcl -notrace
create_project: Time (s): cpu = 00:00:07 ; elapsed = 00:00:12 . Memory (MB): peak = 459.828 ; gain = 185.730
Command: read_checkpoint -auto_incremental -incremental C:/Users/thuyh/OneDrive/Documents/digital_clock/digital_clock.srcs/utils_1/imports/synth_1/digital_clock.dcp
INFO: [Vivado 12-5825] Read reference checkpoint from C:/Users/thuyh/OneDrive/Documents/digital_clock/digital_clock.srcs/utils_1/imports/synth_1/digital_clock.dcp for incremental synthesis
INFO: [Vivado 12-7989] Please ensure there are no constraint changes
Command: synth_design -top digital_clock -part xc7z020clg400-1
Starting synth_design
Attempting to get a license for feature 'Synthesis' and/or device 'xc7z020'
INFO: [Common 17-349] Got license for feature 'Synthesis' and/or device 'xc7z020'
INFO: [Device 21-403] Loading part xc7z020clg400-1
INFO: [Designutils 20-5440] No compile time benefit to using incremental synthesis; A full resynthesis will be run
INFO: [Designutils 20-4379] Flow is switching to default flow due to incremental criteria not met. If you would like to alter this behaviour and have the flow terminate instead, please set the following parameter config_implementation {autoIncr.Synth.RejectBehavior Terminate}
INFO: [Synth 8-7079] Multithreading enabled for synth_design using a maximum of 2 processes.
INFO: [Synth 8-7078] Launching helper process for spawning children vivado processes
INFO: [Synth 8-7075] Helper process launched with PID 6200
---------------------------------------------------------------------------------
Starting RTL Elaboration : Time (s): cpu = 00:00:06 ; elapsed = 00:00:14 . Memory (MB): peak = 1322.602 ; gain = 441.020
---------------------------------------------------------------------------------
INFO: [Synth 8-11241] undeclared symbol 'add1hour_btn', assumed default net type 'wire' [C:/Users/thuyh/OneDrive/Documents/add/add.srcs/sources_1/new/add.v:31]
INFO: [Synth 8-11241] undeclared symbol 'add1min_btn', assumed default net type 'wire' [C:/Users/thuyh/OneDrive/Documents/add/add.srcs/sources_1/new/add.v:32]
INFO: [Synth 8-11241] undeclared symbol 'control_out', assumed default net type 'wire' [C:/Users/thuyh/OneDrive/Documents/control_all/control_all.srcs/sources_1/new/control_all.v:28]
WARNING: [Synth 8-8895] 'control_out' is already implicitly declared on line 28 [C:/Users/thuyh/OneDrive/Documents/control_all/control_all.srcs/sources_1/new/control_all.v:29]
WARNING: [Synth 8-9398] empty port in module declaration [C:/Users/thuyh/OneDrive/Documents/counter_/counter_.srcs/sources_1/new/counter_sum.v:24]
INFO: [Synth 8-11241] undeclared symbol 'control_out', assumed default net type 'wire' [C:/Users/thuyh/OneDrive/Documents/digital_clock/digital_clock.srcs/sources_1/new/digital_clock.v:33]
WARNING: [Synth 8-8895] 'control_out' is already implicitly declared on line 33 [C:/Users/thuyh/OneDrive/Documents/digital_clock/digital_clock.srcs/sources_1/new/digital_clock.v:37]
INFO: [Synth 8-6157] synthesizing module 'digital_clock' [C:/Users/thuyh/OneDrive/Documents/digital_clock/digital_clock.srcs/sources_1/new/digital_clock.v:23]
INFO: [Synth 8-6157] synthesizing module 'control_all' [C:/Users/thuyh/OneDrive/Documents/control_all/control_all.srcs/sources_1/new/control_all.v:23]
INFO: [Synth 8-6157] synthesizing module 'control' [C:/Users/thuyh/OneDrive/Documents/control/control.srcs/sources_1/new/control.v:23]
INFO: [Synth 8-6157] synthesizing module 'RisingEdgeDetector' [C:/Users/thuyh/OneDrive/Documents/Risingedge.v:23]
INFO: [Synth 8-6155] done synthesizing module 'RisingEdgeDetector' (0#1) [C:/Users/thuyh/OneDrive/Documents/Risingedge.v:23]
INFO: [Synth 8-6155] done synthesizing module 'control' (0#1) [C:/Users/thuyh/OneDrive/Documents/control/control.srcs/sources_1/new/control.v:23]
INFO: [Synth 8-6157] synthesizing module 'add' [C:/Users/thuyh/OneDrive/Documents/add/add.srcs/sources_1/new/add.v:23]
INFO: [Synth 8-6155] done synthesizing module 'add' (0#1) [C:/Users/thuyh/OneDrive/Documents/add/add.srcs/sources_1/new/add.v:23]
INFO: [Synth 8-6157] synthesizing module 'reset' [C:/Users/thuyh/OneDrive/Documents/reset/reset.srcs/sources_1/new/reset.v:23]
INFO: [Synth 8-6155] done synthesizing module 'reset' (0#1) [C:/Users/thuyh/OneDrive/Documents/reset/reset.srcs/sources_1/new/reset.v:23]
INFO: [Synth 8-6157] synthesizing module 'create1hz' [C:/Users/thuyh/OneDrive/Documents/normal/normal.srcs/sources_1/new/create1hz.v:23]
INFO: [Synth 8-6155] done synthesizing module 'create1hz' (0#1) [C:/Users/thuyh/OneDrive/Documents/normal/normal.srcs/sources_1/new/create1hz.v:23]
INFO: [Synth 8-6155] done synthesizing module 'control_all' (0#1) [C:/Users/thuyh/OneDrive/Documents/control_all/control_all.srcs/sources_1/new/control_all.v:23]
INFO: [Synth 8-6157] synthesizing module 'counter_all' [C:/Users/thuyh/OneDrive/Documents/function/function.srcs/sources_1/new/function.v:23]
INFO: [Synth 8-6157] synthesizing module 'counter' [C:/Users/thuyh/OneDrive/Documents/counter_/counter_.srcs/sources_1/new/counter.v:23]
INFO: [Synth 8-6157] synthesizing module 'pause' [C:/Users/thuyh/OneDrive/Documents/counter_/counter_.srcs/sources_1/new/pause.v:23]
INFO: [Synth 8-6155] done synthesizing module 'pause' (0#1) [C:/Users/thuyh/OneDrive/Documents/counter_/counter_.srcs/sources_1/new/pause.v:23]
INFO: [Synth 8-6157] synthesizing module 'counter_sum' [C:/Users/thuyh/OneDrive/Documents/counter_/counter_.srcs/sources_1/new/counter_sum.v:23]
WARNING: [Synth 8-308] ignoring empty port [C:/Users/thuyh/OneDrive/Documents/counter_/counter_.srcs/sources_1/new/counter_sum.v:24]
INFO: [Synth 8-6155] done synthesizing module 'counter_sum' (0#1) [C:/Users/thuyh/OneDrive/Documents/counter_/counter_.srcs/sources_1/new/counter_sum.v:23]
WARNING: [Synth 8-7023] instance 'counter_sum1' of module 'counter_sum' has 5 connections declared, but only 4 given [C:/Users/thuyh/OneDrive/Documents/counter_/counter_.srcs/sources_1/new/counter.v:32]
INFO: [Synth 8-6157] synthesizing module 'counter_hour' [C:/Users/thuyh/OneDrive/Documents/counter_/counter_.srcs/sources_1/new/counter_hour.v:23]
INFO: [Synth 8-6155] done synthesizing module 'counter_hour' (0#1) [C:/Users/thuyh/OneDrive/Documents/counter_/counter_.srcs/sources_1/new/counter_hour.v:23]
INFO: [Synth 8-6157] synthesizing module 'counter_min' [C:/Users/thuyh/OneDrive/Documents/counter_/counter_.srcs/sources_1/new/counter_min.v:23]
INFO: [Synth 8-6155] done synthesizing module 'counter_min' (0#1) [C:/Users/thuyh/OneDrive/Documents/counter_/counter_.srcs/sources_1/new/counter_min.v:23]
INFO: [Synth 8-6157] synthesizing module 'counter_second' [C:/Users/thuyh/OneDrive/Documents/counter_/counter_.srcs/sources_1/new/counter_second.v:23]
INFO: [Synth 8-6155] done synthesizing module 'counter_second' (0#1) [C:/Users/thuyh/OneDrive/Documents/counter_/counter_.srcs/sources_1/new/counter_second.v:23]
INFO: [Synth 8-6155] done synthesizing module 'counter' (0#1) [C:/Users/thuyh/OneDrive/Documents/counter_/counter_.srcs/sources_1/new/counter.v:23]
INFO: [Synth 8-6157] synthesizing module 'normal' [C:/Users/thuyh/OneDrive/Documents/normal/normal.srcs/sources_1/new/normal.v:23]
INFO: [Synth 8-6157] synthesizing module 'normal_sum' [C:/Users/thuyh/OneDrive/Documents/normal/normal.srcs/sources_1/new/normal_sum.v:23]
WARNING: [Synth 8-567] referenced signal 'counter_sum' should be on the sensitivity list [C:/Users/thuyh/OneDrive/Documents/normal/normal.srcs/sources_1/new/normal_sum.v:28]
INFO: [Synth 8-6155] done synthesizing module 'normal_sum' (0#1) [C:/Users/thuyh/OneDrive/Documents/normal/normal.srcs/sources_1/new/normal_sum.v:23]
INFO: [Synth 8-6157] synthesizing module 'normal_hour' [C:/Users/thuyh/OneDrive/Documents/normal/normal.srcs/sources_1/new/normal_hour.v:23]
INFO: [Synth 8-6155] done synthesizing module 'normal_hour' (0#1) [C:/Users/thuyh/OneDrive/Documents/normal/normal.srcs/sources_1/new/normal_hour.v:23]
INFO: [Synth 8-6157] synthesizing module 'normal_min' [C:/Users/thuyh/OneDrive/Documents/normal/normal.srcs/sources_1/new/normal_min.v:23]
INFO: [Synth 8-6155] done synthesizing module 'normal_min' (0#1) [C:/Users/thuyh/OneDrive/Documents/normal/normal.srcs/sources_1/new/normal_min.v:23]
INFO: [Synth 8-6157] synthesizing module 'normal_second' [C:/Users/thuyh/OneDrive/Documents/normal/normal.srcs/sources_1/new/normal_second.v:23]
INFO: [Synth 8-6155] done synthesizing module 'normal_second' (0#1) [C:/Users/thuyh/OneDrive/Documents/normal/normal.srcs/sources_1/new/normal_second.v:23]
INFO: [Synth 8-6155] done synthesizing module 'normal' (0#1) [C:/Users/thuyh/OneDrive/Documents/normal/normal.srcs/sources_1/new/normal.v:23]
INFO: [Synth 8-6157] synthesizing module 'alarm' [C:/Users/thuyh/OneDrive/Documents/alarm/project_5.srcs/sources_1/new/alarm.v:23]
INFO: [Synth 8-6157] synthesizing module 'alarm_hour' [C:/Users/thuyh/OneDrive/Documents/alarm/project_5.srcs/sources_1/new/alarm_hour.v:23]
INFO: [Synth 8-6155] done synthesizing module 'alarm_hour' (0#1) [C:/Users/thuyh/OneDrive/Documents/alarm/project_5.srcs/sources_1/new/alarm_hour.v:23]
INFO: [Synth 8-6157] synthesizing module 'alarm_min' [C:/Users/thuyh/OneDrive/Documents/alarm/project_5.srcs/sources_1/new/alram_min.v:23]
INFO: [Synth 8-6155] done synthesizing module 'alarm_min' (0#1) [C:/Users/thuyh/OneDrive/Documents/alarm/project_5.srcs/sources_1/new/alram_min.v:23]
INFO: [Synth 8-6155] done synthesizing module 'alarm' (0#1) [C:/Users/thuyh/OneDrive/Documents/alarm/project_5.srcs/sources_1/new/alarm.v:23]
INFO: [Synth 8-6155] done synthesizing module 'counter_all' (0#1) [C:/Users/thuyh/OneDrive/Documents/function/function.srcs/sources_1/new/function.v:23]
INFO: [Synth 8-6157] synthesizing module 'screen_display' [C:/Users/thuyh/OneDrive/Documents/screen_díplay/screen_díplay.srcs/sources_1/new/screen_display.v:23]
INFO: [Synth 8-6157] synthesizing module 'mux_3to1_hour' [C:/Users/thuyh/OneDrive/Documents/digital_clock/digital_clock.srcs/sources_1/new/mux_3to1_hour.v:23]
INFO: [Synth 8-6155] done synthesizing module 'mux_3to1_hour' (0#1) [C:/Users/thuyh/OneDrive/Documents/digital_clock/digital_clock.srcs/sources_1/new/mux_3to1_hour.v:23]
INFO: [Synth 8-6157] synthesizing module 'mux_3to1' [C:/Users/thuyh/OneDrive/Documents/Mux_3_to_1/Mux_3_to_1.srcs/sources_1/new/mux_3to1.v:23]
INFO: [Synth 8-6155] done synthesizing module 'mux_3to1' (0#1) [C:/Users/thuyh/OneDrive/Documents/Mux_3_to_1/Mux_3_to_1.srcs/sources_1/new/mux_3to1.v:23]
INFO: [Synth 8-6157] synthesizing module 'bin2led7_2led_hour' [C:/Users/thuyh/OneDrive/Documents/digital_clock/digital_clock.srcs/sources_1/new/bin2led7_2led_hour.v:23]
INFO: [Synth 8-6157] synthesizing module 'bin2led7' [C:/Users/thuyh/OneDrive/Documents/week2_bai3/week2_bai3.srcs/sources_1/new/bin2led7.v:22]
INFO: [Synth 8-6155] done synthesizing module 'bin2led7' (0#1) [C:/Users/thuyh/OneDrive/Documents/week2_bai3/week2_bai3.srcs/sources_1/new/bin2led7.v:22]
INFO: [Synth 8-6155] done synthesizing module 'bin2led7_2led_hour' (0#1) [C:/Users/thuyh/OneDrive/Documents/digital_clock/digital_clock.srcs/sources_1/new/bin2led7_2led_hour.v:23]
INFO: [Synth 8-6157] synthesizing module 'bin2led7_2led' [C:/Users/thuyh/OneDrive/Documents/bin2_led7_2/bin2_led7_2.srcs/sources_1/new/bin2led7_2led.v:23]
INFO: [Synth 8-6155] done synthesizing module 'bin2led7_2led' (0#1) [C:/Users/thuyh/OneDrive/Documents/bin2_led7_2/bin2_led7_2.srcs/sources_1/new/bin2led7_2led.v:23]
INFO: [Synth 8-6155] done synthesizing module 'screen_display' (0#1) [C:/Users/thuyh/OneDrive/Documents/screen_díplay/screen_díplay.srcs/sources_1/new/screen_display.v:23]
INFO: [Synth 8-6157] synthesizing module 'led_alarm' [C:/Users/thuyh/OneDrive/Documents/led_alarm/led_alarm.srcs/sources_1/new/led_alarm.v:23]
INFO: [Synth 8-6155] done synthesizing module 'led_alarm' (0#1) [C:/Users/thuyh/OneDrive/Documents/led_alarm/led_alarm.srcs/sources_1/new/led_alarm.v:23]
INFO: [Synth 8-6155] done synthesizing module 'digital_clock' (0#1) [C:/Users/thuyh/OneDrive/Documents/digital_clock/digital_clock.srcs/sources_1/new/digital_clock.v:23]
WARNING: [Synth 8-7137] Register clk_1hz_reg in module create1hz has both Set and reset with same priority. This may cause simulation mismatches. Consider rewriting code  [C:/Users/thuyh/OneDrive/Documents/normal/normal.srcs/sources_1/new/create1hz.v:37]
---------------------------------------------------------------------------------
Finished RTL Elaboration : Time (s): cpu = 00:00:08 ; elapsed = 00:00:19 . Memory (MB): peak = 1432.324 ; gain = 550.742
---------------------------------------------------------------------------------
---------------------------------------------------------------------------------
Start Handling Custom Attributes
---------------------------------------------------------------------------------
---------------------------------------------------------------------------------
Finished Handling Custom Attributes : Time (s): cpu = 00:00:08 ; elapsed = 00:00:20 . Memory (MB): peak = 1432.324 ; gain = 550.742
---------------------------------------------------------------------------------
---------------------------------------------------------------------------------
Finished RTL Optimization Phase 1 : Time (s): cpu = 00:00:08 ; elapsed = 00:00:20 . Memory (MB): peak = 1432.324 ; gain = 550.742
---------------------------------------------------------------------------------
Netlist sorting complete. Time (s): cpu = 00:00:00 ; elapsed = 00:00:00.020 . Memory (MB): peak = 1432.324 ; gain = 0.000
INFO: [Project 1-570] Preparing netlist for logic optimization

Processing XDC Constraints
Initializing timing engine
Parsing XDC File [C:/Users/thuyh/Downloads/Arty-Z7-20-Master.xdc]
WARNING: [Vivado 12-584] No ports matched 'count[0]'. [C:/Users/thuyh/Downloads/Arty-Z7-20-Master.xdc:23]
CRITICAL WARNING: [Common 17-55] 'set_property' expects at least one object. [C:/Users/thuyh/Downloads/Arty-Z7-20-Master.xdc:23]
Resolution: If [get_<value>] was used to populate the object, check to make sure this command returns at least one valid object.
WARNING: [Vivado 12-584] No ports matched 'count[1]'. [C:/Users/thuyh/Downloads/Arty-Z7-20-Master.xdc:24]
CRITICAL WARNING: [Common 17-55] 'set_property' expects at least one object. [C:/Users/thuyh/Downloads/Arty-Z7-20-Master.xdc:24]
Resolution: If [get_<value>] was used to populate the object, check to make sure this command returns at least one valid object.
WARNING: [Vivado 12-584] No ports matched 'count[2]'. [C:/Users/thuyh/Downloads/Arty-Z7-20-Master.xdc:25]
CRITICAL WARNING: [Common 17-55] 'set_property' expects at least one object. [C:/Users/thuyh/Downloads/Arty-Z7-20-Master.xdc:25]
Resolution: If [get_<value>] was used to populate the object, check to make sure this command returns at least one valid object.
WARNING: [Vivado 12-584] No ports matched 'count[3]'. [C:/Users/thuyh/Downloads/Arty-Z7-20-Master.xdc:26]
CRITICAL WARNING: [Common 17-55] 'set_property' expects at least one object. [C:/Users/thuyh/Downloads/Arty-Z7-20-Master.xdc:26]
Resolution: If [get_<value>] was used to populate the object, check to make sure this command returns at least one valid object.
WARNING: [Vivado 12-584] No ports matched 'btn'. [C:/Users/thuyh/Downloads/Arty-Z7-20-Master.xdc:29]
CRITICAL WARNING: [Common 17-55] 'set_property' expects at least one object. [C:/Users/thuyh/Downloads/Arty-Z7-20-Master.xdc:29]
Resolution: If [get_<value>] was used to populate the object, check to make sure this command returns at least one valid object.
Finished Parsing XDC File [C:/Users/thuyh/Downloads/Arty-Z7-20-Master.xdc]
INFO: [Project 1-236] Implementation specific constraints were found while reading constraint file [C:/Users/thuyh/Downloads/Arty-Z7-20-Master.xdc]. These constraints will be ignored for synthesis but will be used in implementation. Impacted constraints are listed in the file [.Xil/digital_clock_propImpl.xdc].
Resolution: To avoid this warning, move constraints listed in [.Xil/digital_clock_propImpl.xdc] to another XDC file and exclude this new file from synthesis with the used_in_synthesis property (File Properties dialog in GUI) and re-run elaboration/synthesis.
Completed Processing XDC Constraints

Netlist sorting complete. Time (s): cpu = 00:00:00 ; elapsed = 00:00:00 . Memory (MB): peak = 1534.473 ; gain = 0.000
INFO: [Project 1-111] Unisim Transformation Summary:
No Unisim elements were transformed.

The system cannot find the path specified.
Constraint Validation Runtime : Time (s): cpu = 00:00:00 ; elapsed = 00:00:00.058 . Memory (MB): peak = 1534.473 ; gain = 0.000
INFO: [Designutils 20-5440] No compile time benefit to using incremental synthesis; A full resynthesis will be run
INFO: [Designutils 20-4379] Flow is switching to default flow due to incremental criteria not met. If you would like to alter this behaviour and have the flow terminate instead, please set the following parameter config_implementation {autoIncr.Synth.RejectBehavior Terminate}
---------------------------------------------------------------------------------
Finished Constraint Validation : Time (s): cpu = 00:00:23 ; elapsed = 00:00:53 . Memory (MB): peak = 1534.473 ; gain = 652.891
---------------------------------------------------------------------------------
---------------------------------------------------------------------------------
Start Loading Part and Timing Information
---------------------------------------------------------------------------------
Loading part: xc7z020clg400-1
---------------------------------------------------------------------------------
Finished Loading Part and Timing Information : Time (s): cpu = 00:00:23 ; elapsed = 00:00:54 . Memory (MB): peak = 1534.473 ; gain = 652.891
---------------------------------------------------------------------------------
---------------------------------------------------------------------------------
Start Applying 'set_property' XDC Constraints
---------------------------------------------------------------------------------
---------------------------------------------------------------------------------
Finished applying 'set_property' XDC Constraints : Time (s): cpu = 00:00:23 ; elapsed = 00:00:54 . Memory (MB): peak = 1534.473 ; gain = 652.891
---------------------------------------------------------------------------------
WARNING: [Synth 8-327] inferring latch for variable 'counter_sum_reg' [C:/Users/thuyh/OneDrive/Documents/normal/normal.srcs/sources_1/new/normal_sum.v:30]
---------------------------------------------------------------------------------
Finished RTL Optimization Phase 2 : Time (s): cpu = 00:00:24 ; elapsed = 00:00:55 . Memory (MB): peak = 1534.473 ; gain = 652.891
---------------------------------------------------------------------------------
---------------------------------------------------------------------------------
Start RTL Component Statistics 
---------------------------------------------------------------------------------
Detailed RTL Component Info : 
+---Adders : 
	   2 Input   32 Bit       Adders := 1     
	   2 Input   26 Bit       Adders := 1     
	   2 Input   17 Bit       Adders := 3     
	   2 Input    6 Bit       Adders := 1     
	   2 Input    5 Bit       Adders := 1     
	   2 Input    2 Bit       Adders := 1     
+---Registers : 
	               32 Bit    Registers := 1     
	               26 Bit    Registers := 1     
	               17 Bit    Registers := 1     
	                7 Bit    Registers := 6     
	                6 Bit    Registers := 7     
	                5 Bit    Registers := 4     
	                2 Bit    Registers := 1     
	                1 Bit    Registers := 30    
+---Muxes : 
	   2 Input   32 Bit        Muxes := 1     
	   2 Input   26 Bit        Muxes := 1     
	   2 Input   17 Bit        Muxes := 2     
	   2 Input   12 Bit        Muxes := 1     
	   2 Input    6 Bit        Muxes := 5     
	   2 Input    5 Bit        Muxes := 3     
	   2 Input    2 Bit        Muxes := 1     
	   2 Input    1 Bit        Muxes := 10    
---------------------------------------------------------------------------------
Finished RTL Component Statistics 
---------------------------------------------------------------------------------
---------------------------------------------------------------------------------
Start Part Resource Summary
---------------------------------------------------------------------------------
Part Resources:
DSPs: 220 (col length:60)
BRAMs: 280 (col length: RAMB18 60 RAMB36 30)
---------------------------------------------------------------------------------
Finished Part Resource Summary
---------------------------------------------------------------------------------
---------------------------------------------------------------------------------
Start Cross Boundary and Area Optimization
---------------------------------------------------------------------------------
WARNING: [Synth 8-7080] Parallel synthesis criteria is not met
---------------------------------------------------------------------------------
Finished Cross Boundary and Area Optimization : Time (s): cpu = 00:00:31 ; elapsed = 00:01:08 . Memory (MB): peak = 1534.473 ; gain = 652.891
---------------------------------------------------------------------------------
---------------------------------------------------------------------------------
Start Applying XDC Timing Constraints
---------------------------------------------------------------------------------
---------------------------------------------------------------------------------
Finished Applying XDC Timing Constraints : Time (s): cpu = 00:00:39 ; elapsed = 00:01:21 . Memory (MB): peak = 1534.473 ; gain = 652.891
---------------------------------------------------------------------------------
---------------------------------------------------------------------------------
Start Timing Optimization
---------------------------------------------------------------------------------
---------------------------------------------------------------------------------
Finished Timing Optimization : Time (s): cpu = 00:00:40 ; elapsed = 00:01:22 . Memory (MB): peak = 1534.473 ; gain = 652.891
---------------------------------------------------------------------------------
---------------------------------------------------------------------------------
Start Technology Mapping
---------------------------------------------------------------------------------
---------------------------------------------------------------------------------
Finished Technology Mapping : Time (s): cpu = 00:00:40 ; elapsed = 00:01:22 . Memory (MB): peak = 1534.473 ; gain = 652.891
---------------------------------------------------------------------------------
---------------------------------------------------------------------------------
Start IO Insertion
---------------------------------------------------------------------------------
---------------------------------------------------------------------------------
Start Flattening Before IO Insertion
---------------------------------------------------------------------------------
---------------------------------------------------------------------------------
Finished Flattening Before IO Insertion
---------------------------------------------------------------------------------
---------------------------------------------------------------------------------
Start Final Netlist Cleanup
---------------------------------------------------------------------------------
---------------------------------------------------------------------------------
Finished Final Netlist Cleanup
---------------------------------------------------------------------------------
---------------------------------------------------------------------------------
Finished IO Insertion : Time (s): cpu = 00:00:47 ; elapsed = 00:01:31 . Memory (MB): peak = 1534.473 ; gain = 652.891
---------------------------------------------------------------------------------
---------------------------------------------------------------------------------
Start Renaming Generated Instances
---------------------------------------------------------------------------------
---------------------------------------------------------------------------------
Finished Renaming Generated Instances : Time (s): cpu = 00:00:47 ; elapsed = 00:01:31 . Memory (MB): peak = 1534.473 ; gain = 652.891
---------------------------------------------------------------------------------
CRITICAL WARNING: [Synth 8-6859] multi-driven net on pin counter_all1/normal1/counter_sum[16] with 1st driver pin 'counter_all1/normal1/sum1/counter_sum_reg[16]/Q' [C:/Users/thuyh/OneDrive/Documents/normal/normal.srcs/sources_1/new/normal_sum.v:40]
CRITICAL WARNING: [Synth 8-6859] multi-driven net on pin counter_all1/normal1/counter_sum[16] with 2nd driver pin 'counter_all1/normal1/sum1/counter_sum_reg[16]__0/Q' [C:/Users/thuyh/OneDrive/Documents/normal/normal.srcs/sources_1/new/normal_sum.v:30]
CRITICAL WARNING: [Synth 8-6859] multi-driven net on pin counter_all1/normal1/counter_sum[15] with 1st driver pin 'counter_all1/normal1/sum1/counter_sum_reg[15]/Q' [C:/Users/thuyh/OneDrive/Documents/normal/normal.srcs/sources_1/new/normal_sum.v:40]
CRITICAL WARNING: [Synth 8-6859] multi-driven net on pin counter_all1/normal1/counter_sum[15] with 2nd driver pin 'counter_all1/normal1/sum1/counter_sum_reg[15]__0/Q' [C:/Users/thuyh/OneDrive/Documents/normal/normal.srcs/sources_1/new/normal_sum.v:30]
CRITICAL WARNING: [Synth 8-6859] multi-driven net on pin counter_all1/normal1/counter_sum[14] with 1st driver pin 'counter_all1/normal1/sum1/counter_sum_reg[14]/Q' [C:/Users/thuyh/OneDrive/Documents/normal/normal.srcs/sources_1/new/normal_sum.v:40]
CRITICAL WARNING: [Synth 8-6859] multi-driven net on pin counter_all1/normal1/counter_sum[14] with 2nd driver pin 'counter_all1/normal1/sum1/counter_sum_reg[14]__0/Q' [C:/Users/thuyh/OneDrive/Documents/normal/normal.srcs/sources_1/new/normal_sum.v:30]
CRITICAL WARNING: [Synth 8-6859] multi-driven net on pin counter_all1/normal1/counter_sum[13] with 1st driver pin 'counter_all1/normal1/sum1/counter_sum_reg[13]/Q' [C:/Users/thuyh/OneDrive/Documents/normal/normal.srcs/sources_1/new/normal_sum.v:40]
CRITICAL WARNING: [Synth 8-6859] multi-driven net on pin counter_all1/normal1/counter_sum[13] with 2nd driver pin 'counter_all1/normal1/sum1/counter_sum_reg[13]__0/Q' [C:/Users/thuyh/OneDrive/Documents/normal/normal.srcs/sources_1/new/normal_sum.v:30]
CRITICAL WARNING: [Synth 8-6859] multi-driven net on pin counter_all1/normal1/counter_sum[12] with 1st driver pin 'counter_all1/normal1/sum1/counter_sum_reg[12]/Q' [C:/Users/thuyh/OneDrive/Documents/normal/normal.srcs/sources_1/new/normal_sum.v:40]
CRITICAL WARNING: [Synth 8-6859] multi-driven net on pin counter_all1/normal1/counter_sum[12] with 2nd driver pin 'counter_all1/normal1/sum1/counter_sum_reg[12]__0/Q' [C:/Users/thuyh/OneDrive/Documents/normal/normal.srcs/sources_1/new/normal_sum.v:30]
CRITICAL WARNING: [Synth 8-6859] multi-driven net on pin counter_all1/normal1/counter_sum[11] with 1st driver pin 'counter_all1/normal1/sum1/counter_sum_reg[11]/Q' [C:/Users/thuyh/OneDrive/Documents/normal/normal.srcs/sources_1/new/normal_sum.v:40]
CRITICAL WARNING: [Synth 8-6859] multi-driven net on pin counter_all1/normal1/counter_sum[11] with 2nd driver pin 'counter_all1/normal1/sum1/counter_sum_reg[11]__0/Q' [C:/Users/thuyh/OneDrive/Documents/normal/normal.srcs/sources_1/new/normal_sum.v:30]
CRITICAL WARNING: [Synth 8-6859] multi-driven net on pin counter_all1/normal1/counter_sum[10] with 1st driver pin 'counter_all1/normal1/sum1/counter_sum_reg[10]/Q' [C:/Users/thuyh/OneDrive/Documents/normal/normal.srcs/sources_1/new/normal_sum.v:40]
CRITICAL WARNING: [Synth 8-6859] multi-driven net on pin counter_all1/normal1/counter_sum[10] with 2nd driver pin 'counter_all1/normal1/sum1/counter_sum_reg[10]__0/Q' [C:/Users/thuyh/OneDrive/Documents/normal/normal.srcs/sources_1/new/normal_sum.v:30]
CRITICAL WARNING: [Synth 8-6859] multi-driven net on pin counter_all1/normal1/counter_sum[9] with 1st driver pin 'counter_all1/normal1/sum1/counter_sum_reg[9]/Q' [C:/Users/thuyh/OneDrive/Documents/normal/normal.srcs/sources_1/new/normal_sum.v:40]
CRITICAL WARNING: [Synth 8-6859] multi-driven net on pin counter_all1/normal1/counter_sum[9] with 2nd driver pin 'counter_all1/normal1/sum1/counter_sum_reg[9]__0/Q' [C:/Users/thuyh/OneDrive/Documents/normal/normal.srcs/sources_1/new/normal_sum.v:30]
CRITICAL WARNING: [Synth 8-6859] multi-driven net on pin counter_all1/normal1/counter_sum[8] with 1st driver pin 'counter_all1/normal1/sum1/counter_sum_reg[8]/Q' [C:/Users/thuyh/OneDrive/Documents/normal/normal.srcs/sources_1/new/normal_sum.v:40]
CRITICAL WARNING: [Synth 8-6859] multi-driven net on pin counter_all1/normal1/counter_sum[8] with 2nd driver pin 'counter_all1/normal1/sum1/counter_sum_reg[8]__0/Q' [C:/Users/thuyh/OneDrive/Documents/normal/normal.srcs/sources_1/new/normal_sum.v:30]
CRITICAL WARNING: [Synth 8-6859] multi-driven net on pin counter_all1/normal1/counter_sum[7] with 1st driver pin 'counter_all1/normal1/sum1/counter_sum_reg[7]/Q' [C:/Users/thuyh/OneDrive/Documents/normal/normal.srcs/sources_1/new/normal_sum.v:40]
CRITICAL WARNING: [Synth 8-6859] multi-driven net on pin counter_all1/normal1/counter_sum[7] with 2nd driver pin 'counter_all1/normal1/sum1/counter_sum_reg[7]__0/Q' [C:/Users/thuyh/OneDrive/Documents/normal/normal.srcs/sources_1/new/normal_sum.v:30]
CRITICAL WARNING: [Synth 8-6859] multi-driven net on pin counter_all1/normal1/counter_sum[6] with 1st driver pin 'counter_all1/normal1/sum1/counter_sum_reg[6]/Q' [C:/Users/thuyh/OneDrive/Documents/normal/normal.srcs/sources_1/new/normal_sum.v:40]
CRITICAL WARNING: [Synth 8-6859] multi-driven net on pin counter_all1/normal1/counter_sum[6] with 2nd driver pin 'counter_all1/normal1/sum1/counter_sum_reg[6]__0/Q' [C:/Users/thuyh/OneDrive/Documents/normal/normal.srcs/sources_1/new/normal_sum.v:30]
CRITICAL WARNING: [Synth 8-6859] multi-driven net on pin counter_all1/normal1/counter_sum[5] with 1st driver pin 'counter_all1/normal1/sum1/counter_sum_reg[5]/Q' [C:/Users/thuyh/OneDrive/Documents/normal/normal.srcs/sources_1/new/normal_sum.v:40]
CRITICAL WARNING: [Synth 8-6859] multi-driven net on pin counter_all1/normal1/counter_sum[5] with 2nd driver pin 'counter_all1/normal1/sum1/counter_sum_reg[5]__0/Q' [C:/Users/thuyh/OneDrive/Documents/normal/normal.srcs/sources_1/new/normal_sum.v:30]
CRITICAL WARNING: [Synth 8-6859] multi-driven net on pin counter_all1/normal1/counter_sum[4] with 1st driver pin 'counter_all1/normal1/sum1/counter_sum_reg[4]/Q' [C:/Users/thuyh/OneDrive/Documents/normal/normal.srcs/sources_1/new/normal_sum.v:40]
CRITICAL WARNING: [Synth 8-6859] multi-driven net on pin counter_all1/normal1/counter_sum[4] with 2nd driver pin 'counter_all1/normal1/sum1/counter_sum_reg[4]__0/Q' [C:/Users/thuyh/OneDrive/Documents/normal/normal.srcs/sources_1/new/normal_sum.v:30]
CRITICAL WARNING: [Synth 8-6859] multi-driven net on pin counter_all1/normal1/counter_sum[3] with 1st driver pin 'counter_all1/normal1/sum1/counter_sum_reg[3]/Q' [C:/Users/thuyh/OneDrive/Documents/normal/normal.srcs/sources_1/new/normal_sum.v:40]
CRITICAL WARNING: [Synth 8-6859] multi-driven net on pin counter_all1/normal1/counter_sum[3] with 2nd driver pin 'counter_all1/normal1/sum1/counter_sum_reg[3]__0/Q' [C:/Users/thuyh/OneDrive/Documents/normal/normal.srcs/sources_1/new/normal_sum.v:30]
CRITICAL WARNING: [Synth 8-6859] multi-driven net on pin counter_all1/normal1/counter_sum[2] with 1st driver pin 'counter_all1/normal1/sum1/counter_sum_reg[2]/Q' [C:/Users/thuyh/OneDrive/Documents/normal/normal.srcs/sources_1/new/normal_sum.v:40]
CRITICAL WARNING: [Synth 8-6859] multi-driven net on pin counter_all1/normal1/counter_sum[2] with 2nd driver pin 'counter_all1/normal1/sum1/counter_sum_reg[2]__0/Q' [C:/Users/thuyh/OneDrive/Documents/normal/normal.srcs/sources_1/new/normal_sum.v:30]
CRITICAL WARNING: [Synth 8-6859] multi-driven net on pin counter_all1/normal1/counter_sum[1] with 1st driver pin 'counter_all1/normal1/sum1/counter_sum_reg[1]/Q' [C:/Users/thuyh/OneDrive/Documents/normal/normal.srcs/sources_1/new/normal_sum.v:40]
CRITICAL WARNING: [Synth 8-6859] multi-driven net on pin counter_all1/normal1/counter_sum[1] with 2nd driver pin 'counter_all1/normal1/sum1/counter_sum_reg[1]__0/Q' [C:/Users/thuyh/OneDrive/Documents/normal/normal.srcs/sources_1/new/normal_sum.v:30]
CRITICAL WARNING: [Synth 8-6859] multi-driven net on pin counter_all1/normal1/counter_sum[0] with 1st driver pin 'counter_all1/normal1/sum1/counter_sum_reg[0]/Q' [C:/Users/thuyh/OneDrive/Documents/normal/normal.srcs/sources_1/new/normal_sum.v:40]
CRITICAL WARNING: [Synth 8-6859] multi-driven net on pin counter_all1/normal1/counter_sum[0] with 2nd driver pin 'counter_all1/normal1/sum1/counter_sum_reg[0]__0/Q' [C:/Users/thuyh/OneDrive/Documents/normal/normal.srcs/sources_1/new/normal_sum.v:30]

Report Check Netlist: 
+------+------------------+-------+---------+-------+------------------+
|      |Item              |Errors |Warnings |Status |Description       |
+------+------------------+-------+---------+-------+------------------+
|1     |multi_driven_nets |      0|       17|Failed |Multi driven nets |
+------+------------------+-------+---------+-------+------------------+
---------------------------------------------------------------------------------
Start Rebuilding User Hierarchy
---------------------------------------------------------------------------------
---------------------------------------------------------------------------------
Finished Rebuilding User Hierarchy : Time (s): cpu = 00:00:47 ; elapsed = 00:01:31 . Memory (MB): peak = 1534.473 ; gain = 652.891
---------------------------------------------------------------------------------
---------------------------------------------------------------------------------
Start Renaming Generated Ports
---------------------------------------------------------------------------------
---------------------------------------------------------------------------------
Finished Renaming Generated Ports : Time (s): cpu = 00:00:47 ; elapsed = 00:01:31 . Memory (MB): peak = 1534.473 ; gain = 652.891
---------------------------------------------------------------------------------
---------------------------------------------------------------------------------
Start Handling Custom Attributes
---------------------------------------------------------------------------------
---------------------------------------------------------------------------------
Finished Handling Custom Attributes : Time (s): cpu = 00:00:47 ; elapsed = 00:01:32 . Memory (MB): peak = 1534.473 ; gain = 652.891
---------------------------------------------------------------------------------
---------------------------------------------------------------------------------
Start Renaming Generated Nets
---------------------------------------------------------------------------------
---------------------------------------------------------------------------------
Finished Renaming Generated Nets : Time (s): cpu = 00:00:47 ; elapsed = 00:01:32 . Memory (MB): peak = 1534.473 ; gain = 652.891
---------------------------------------------------------------------------------
---------------------------------------------------------------------------------
Start Writing Synthesis Report
---------------------------------------------------------------------------------

Report BlackBoxes: 
+-+--------------+----------+
| |BlackBox name |Instances |
+-+--------------+----------+
+-+--------------+----------+

Report Cell Usage: 
+------+-------+------+
|      |Cell   |Count |
+------+-------+------+
|1     |BUFG   |     2|
|2     |CARRY4 |   109|
|3     |LUT1   |    51|
|4     |LUT2   |   211|
|5     |LUT3   |    71|
|6     |LUT4   |   116|
|7     |LUT5   |    64|
|8     |LUT6   |    86|
|9     |FDCE   |    60|
|10    |FDPE   |     1|
|11    |FDRE   |   163|
|12    |LD     |    17|
|13    |IBUF   |     5|
|14    |OBUF   |    43|
+------+-------+------+
---------------------------------------------------------------------------------
Finished Writing Synthesis Report : Time (s): cpu = 00:00:47 ; elapsed = 00:01:32 . Memory (MB): peak = 1534.473 ; gain = 652.891
---------------------------------------------------------------------------------
Synthesis finished with 0 errors, 34 critical warnings and 2 warnings.
Synthesis Optimization Runtime : Time (s): cpu = 00:00:36 ; elapsed = 00:01:22 . Memory (MB): peak = 1534.473 ; gain = 550.742
Synthesis Optimization Complete : Time (s): cpu = 00:00:47 ; elapsed = 00:01:32 . Memory (MB): peak = 1534.473 ; gain = 652.891
INFO: [Project 1-571] Translating synthesized netlist
Netlist sorting complete. Time (s): cpu = 00:00:00 ; elapsed = 00:00:00.032 . Memory (MB): peak = 1534.473 ; gain = 0.000
INFO: [Netlist 29-17] Analyzing 126 Unisim elements for replacement
INFO: [Netlist 29-28] Unisim Transformation completed in 0 CPU seconds
INFO: [Project 1-570] Preparing netlist for logic optimization
INFO: [Opt 31-138] Pushed 0 inverter(s) to 0 load pin(s).
Netlist sorting complete. Time (s): cpu = 00:00:00 ; elapsed = 00:00:00.001 . Memory (MB): peak = 1534.473 ; gain = 0.000
INFO: [Project 1-111] Unisim Transformation Summary:
  A total of 17 instances were transformed.
  LD => LDCE: 17 instances

The system cannot find the path specified.
Synth Design complete | Checksum: 90cc0f5f
INFO: [Common 17-83] Releasing license: Synthesis
83 Infos, 14 Warnings, 39 Critical Warnings and 0 Errors encountered.
synth_design completed successfully
synth_design: Time (s): cpu = 00:00:53 ; elapsed = 00:01:58 . Memory (MB): peak = 1534.473 ; gain = 1071.699
INFO: [runtcl-6] Synthesis results are not added to the cache due to CRITICAL_WARNING
Write ShapeDB Complete: Time (s): cpu = 00:00:00 ; elapsed = 00:00:00.015 . Memory (MB): peak = 1534.473 ; gain = 0.000
[libprotobuf ERROR C:\w10\HEAD\src\ext\protobuf\build\lnx64\protobuf-3.7.1\src\google\protobuf\wire_format_lite.cc:611] String field 'HDMetricDBGroup.MetricMapEntry.value' contains invalid UTF-8 data when serializing a protocol buffer. Use the 'bytes' type if you intend to send raw bytes. 
INFO: [Common 17-1381] The checkpoint 'C:/Users/thuyh/OneDrive/Documents/digital_clock/digital_clock.runs/synth_1/digital_clock.dcp' has been generated.
INFO: [runtcl-4] Executing : report_utilization -file digital_clock_utilization_synth.rpt -pb digital_clock_utilization_synth.pb
INFO: [Common 17-206] Exiting Vivado at Tue Jun 11 11:39:05 2024...
